{
  "component_id": "o_1310",
  "category": "band",
  "subcategory": "o_band",
  "vendor": null,
  "model": null,
  "version": "1.0",
  "params": {
    "wavelength_nm": 1310,
    "fiber_loss_db_per_km": 0.33,
    "dispersion_ps_per_km": 3.0
  },
  "tags": ["o_band", "telecom", "1310nm"],
  "notes": "O-band (1310 nm) zero-dispersion window."
}
